{
  "schema_version": 1,
  "bvid": "BV1234567890",
  "page": 1,
  "title": "【格式示例，非真实视频】用纸球解释月相变化",
  "summary": "【合成格式示例，非真实观看记录】视频先用灯光照射纸球，说明球面始终只有一半受到照明；随后改变观察位置，演示看见的受光部分为什么有时像弯月、有时接近圆形。最后区分月相变化与月食，提醒观众不要把地球遮挡当成月相变化的原因。适合想通过直观小实验了解月相的观众。",
  "tags": ["天文入门", "月相", "实验演示"],
  "provenance": {
    "contributor_type": "bot",
    "basis": "video"
  },
  "highlights": [
    {"at_seconds": 25, "point": "【合成示例】用灯光照射纸球，演示同一时刻只有一半球面受光。"},
    {"at_seconds": 80, "point": "【合成示例】改变观察位置，展示看见的受光部分如何变化。"}
  ]
}
